{
  "$schema": "../schemas/weapon-grids.schema.json",
  "version": "2.0.0",
  "generatedAt": "2026-10-13T08:30:00.000Z",
  "description": "Weapon grid setups across all six elements, covering Magna 1 through Magna 3 and Primal builds.",
  "elements": [
    {
      "elementId": "fire",
      "elementName": "Fire",
      "magnaGrids": [
        {
          "gridId": "fire_m1_basic",
          "tier": "M1",
          "name": "Colossus Cane Starter Grid",
          "archetype": "Stamina",
          "mainSummon": "Colossus Omega (Lv 100-200)",
          "supporterSummon": "Shiva (Lv 150) or Colossus Omega (Lv 250)",
          "hpModifierEstimated": "+15%",
          "criticalHitRatePercent": 0,
          "slots": [
            {
              "slotType": "Mainhand",
              "weaponName": "Colossus Breaker",
              "series": "Colossus Omega",
              "recommendedCopies": 1,
              "skillTypes": [
                "Omega ATK"
              ]
            },
            {
              "slotType": "GridSlot",
              "weaponName": "Colossus Cane Omega",
              "series": "Colossus Omega",
              "recommendedCopies": 5,
              "skillTypes": [
                "Omega ATK II"
              ]
            },
            {
              "slotType": "GridSlot",
              "weaponName": "Baha Dagger Nova",
              "series": "Bahamut",
              "recommendedCopies": 1,
              "skillTypes": [
                "Normal ATK/HP"
              ]
            },
            {
              "slotType": "GridSlot",
              "weaponName": "Sword of Michael",
              "series": "Seraphic",
              "recommendedCopies": 1,
              "skillTypes": [
                "Seraphic Boost"
              ]
            },
            {
              "slotType": "GridSlot",
              "weaponName": "Ray of Zhuque",
              "series": "Four Beasts",
              "recommendedCopies": 1,
              "skillTypes": [
                "Normal ATK II"
              ]
            },
            {
              "slotType": "GridSlot",
              "weaponName": "Flamma Orbis",
              "series": "Xeno",
              "recommendedCopies": 1,
              "skillTypes": [
                "EX Massive ATK"
              ]
            }
          ]
        },
        {
          "gridId": "fire_m2_aes_enmity",
          "tier": "M2",
          "name": "Ancient Ecke Sachs Enmity & 100% Critical Grid",
          "archetype": "Critical_100",
          "mainSummon": "Colossus Omega (Lv 200+)",
          "supporterSummon": "Colossus Omega (Lv 200+)",
          "hpModifierEstimated": "+45%",
          "criticalHitRatePercent": 100,
          "slots": [
            {
              "slotType": "Mainhand",
              "weaponName": "Sol Shreck",
              "series": "Astral",
              "recommendedCopies": 1,
              "skillTypes": [
                "EX Extreme ATK"
              ]
            },
            {
              "slotType": "GridSlot",
              "weaponName": "Ancient Ecke Sachs",
              "series": "Old Primarch",
              "recommendedCopies": 4,
              "skillTypes": [
                "Omega Medium ATK",
                "Omega Medium Crit",
                "Omega Medium Enmity"
              ]
            },
            {
              "slotType": "GridSlot",
              "weaponName": "Nilakantha",
              "series": "Shiva Omega II",
              "recommendedCopies": 2,
              "skillTypes": [
                "Omega Stamina",
                "Omega HP"
              ]
            },
            {
              "slotType": "GridSlot",
              "weaponName": "Scythe of Repentance",
              "series": "Dark Opus",
              "recommendedCopies": 1,
              "pendulumOrKey": "Alpha / Stamina",
              "skillTypes": [
                "Omega Massive ATK",
                "Cap Up"
              ]
            },
            {
              "slotType": "GridSlot",
              "weaponName": "Sword of Michael",
              "series": "Seraphic",
              "recommendedCopies": 1,
              "skillTypes": [
                "Seraphic Boost"
              ]
            },
            {
              "slotType": "GridSlot",
              "weaponName": "Heat of The Sun",
              "series": "New World Quartz",
              "recommendedCopies": 1,
              "skillTypes": [
                "EX ATK",
                "Sun Amp"
              ]
            }
          ]
        },
        {
          "gridId": "fire_m3_ira_burst",
          "tier": "M3_LateGame",
          "name": "Colossus Ira Omega Rebirth Hybrid Burst Grid",
          "archetype": "Burst_OTK",
          "mainSummon": "Colossus Ira Omega (Lv 250)",
          "supporterSummon": "Beelzebub / Triple Zero",
          "hpModifierEstimated": "+70%",
          "criticalHitRatePercent": 100,
          "slots": [
            {
              "slotType": "Mainhand",
              "weaponName": "Luin",
              "series": "Grand",
              "recommendedCopies": 1,
              "skillTypes": [
                "Perceval Ignition",
                "Echo"
              ]
            },
            {
              "slotType": "GridSlot",
              "weaponName": "Ira Volcanic Blade",
              "series": "Magna 3",
              "recommendedCopies": 3,
              "awakeningType": "Attack",
              "skillTypes": [
                "Omega Exalted ATK",
                "Omega Crit III"
              ]
            },
            {
              "slotType": "GridSlot",
              "weaponName": "Extinction Blade",
              "series": "Mugen Revans",
              "recommendedCopies": 2,
              "awakeningType": "Attack",
              "skillTypes": [
                "Special ATK Cap",
                "Supplemental"
              ]
            },
            {
              "slotType": "GridSlot",
              "weaponName": "Scythe of Repentance",
              "series": "Dark Opus (Lv 250)",
              "recommendedCopies": 1,
              "pendulumOrKey": "Falsehood / Extremity",
              "skillTypes": [
                "Omega Transcendence"
              ]
            },
            {
              "slotType": "GridSlot",
              "weaponName": "Ultima Sword",
              "series": "Ultima (Lv 200)",
              "recommendedCopies": 1,
              "pendulumOrKey": "Normal Attack Cap / Seraphic",
              "skillTypes": [
                "Proficiency Boost"
              ]
            },
            {
              "slotType": "GridSlot",
              "weaponName": "Sol Shreck",
              "series": "Astral",
              "recommendedCopies": 1,
              "skillTypes": [
                "EX ATK Cap"
              ]
            },
            {
              "slotType": "GridSlot",
              "weaponName": "Heat of The Sun",
              "series": "New World Quartz",
              "recommendedCopies": 1,
              "skillTypes": [
                "Sun Arcarum Amp"
              ]
            }
          ]
        }
      ],
      "primalGrids": [
        {
          "gridId": "fire_primal_agni_percy_sword",
          "name": "Agni Lord of Flames & Crimson Scale Core Grid",
          "archetype": "Stamina_Supplemental",
          "mainSummon": "Agni (Lv 250)",
          "supporterSummon": "Agni (Lv 250) or Beelzebub",
          "criticalHitRatePercent": 100,
          "slots": [
            {
              "slotType": "Mainhand",
              "weaponName": "Lord of Flames",
              "series": "Grand (Percival)",
              "recommendedCopies": 2,
              "skillTypes": [
                "Fire Resonator",
                "Normal Massive ATK"
              ]
            },
            {
              "slotType": "GridSlot",
              "weaponName": "Crimson Scale",
              "series": "Grand (Michael)",
              "recommendedCopies": 2,
              "skillTypes": [
                "Pact",
                "Damage Cap Up"
              ]
            },
            {
              "slotType": "GridSlot",
              "weaponName": "Extinction Blade",
              "series": "Mugen Revans",
              "recommendedCopies": 2,
              "awakeningType": "Special",
              "skillTypes": [
                "Supplemental",
                "Cap"
              ]
            },
            {
              "slotType": "GridSlot",
              "weaponName": "Scythe of Repentance (Primal)",
              "series": "Dark Opus (Lv 250)",
              "recommendedCopies": 1,
              "pendulumOrKey": "Freyr / Temptation",
              "skillTypes": [
                "Primal Transcendence"
              ]
            },
            {
              "slotType": "GridSlot",
              "weaponName": "Ultima Blade",
              "series": "Ultima (Lv 200)",
              "recommendedCopies": 1,
              "pendulumOrKey": "Auto Cap / Seraphic",
              "skillTypes": [
                "Ultima Key"
              ]
            },
            {
              "slotType": "GridSlot",
              "weaponName": "Sol Shreck",
              "series": "Astral",
              "recommendedCopies": 1,
              "skillTypes": [
                "EX Cap"
              ]
            }
          ]
        }
      ],
      "universalComponents": [
        {
          "weaponName": "Scythe of Repentance",
          "series": "Dark Opus",
          "priority": "Mandatory",
          "description": "Core offensive and cap-breaking anchor; ULB/Transcendence provides essential Pendulum/Chain customizations."
        },
        {
          "weaponName": "Extinction Blade",
          "series": "Revans Mugen",
          "priority": "High",
          "description": "Awakening Attack/Special provides flat raw ATK and unconditional special damage cap up."